Series_Title,Released_Year,Runtime,IMDB_Rating,Overview,Meta_score,No_of_Votes,Gross,overview_tokens,Genre_Action,Genre_Adventure,Genre_Animation,Genre_Biography,Genre_Comedy,Genre_Crime,Genre_Drama,Genre_Family,Genre_Fantasy,Genre_Film-Noir,Genre_History,Genre_Horror,Genre_Music,Genre_Musical,Genre_Mystery,Genre_Romance,Genre_Sci-Fi,Genre_Sport,Genre_Thriller,Genre_War,Genre_Western,Cert_16,Cert_A,Cert_Approved,Cert_G,Cert_GP,Cert_PG,Cert_PG-13,Cert_Passed,Cert_R,Cert_TV-14,Cert_TV-MA,Cert_TV-PG,Cert_U,Cert_U/A,Cert_UA,Cert_Unrated,Director_Group,Star1_Group,Star2_Group,Star3_Group,Star4_Group
Children of Men,2006.0,109,7.9,"In 2027, in a chaotic world in which women have become somehow infertile, a former activist agrees to help transport a miraculously pregnant woman to a sanctuary at sea.",84.0,465113,"35,552,383","['chaotic', 'world', 'woman', 'infertile', 'activist', 'agree', 'help', 'transport', 'miraculously', 'pregnant', 'woman', 'sanctuary', 'sea']",0,1,0,0,0,0,1,0,0,0,0,0,0,0,0,0,1,0,0,0,0,False,True,False,False,False,False,False,False,False,False,False,False,False,False,False,False,0,2,1,2,4
Almost Famous,2000.0,122,7.9,A high-school boy is given the chance to write a story for Rolling Stone Magazine about an up-and-coming rock band as he accompanies them on their concert tour.,90.0,252586,"32,534,850","['high', 'school', 'boy', 'give', 'chance', 'write', 'story', 'rolling', 'stone', 'magazine', 'come', 'rock', 'band', 'accompany', 'concert', 'tour']",0,1,0,0,1,0,1,0,0,0,0,0,0,0,0,0,0,0,0,0,0,False,True,False,False,False,False,False,False,False,False,False,False,False,False,False,False,2,2,2,2,2
Mulholland Dr.,2001.0,147,7.9,"After a car wreck on the winding Mulholland Drive renders a woman amnesiac, she and a perky Hollywood-hopeful search for clues and answers across Los Angeles in a twisting venture beyond dreams and reality.",85.0,322031,"7,220,243","['car', 'wreck', 'wind', 'mulholland', 'drive', 'render', 'woman', 'amnesiac', 'perky', 'hollywood', 'hopeful', 'search', 'clue', 'answer', 'los', 'angeles', 'twisting', 'venture', 'dream', 'reality']",0,0,0,0,0,0,1,0,0,0,0,0,0,0,1,0,0,0,1,0,0,False,False,False,False,False,False,False,False,True,False,False,False,False,False,False,False,1,1,2,2,2
Toy Story 2,1999.0,92,7.9,"When Woody is stolen by a toy collector, Buzz and his friends set out on a rescue mission to save Woody before he becomes a museum toy property with his roundup gang Jessie, Prospector, and Bullseye.",88.0,527512,"245,852,179","['woody', 'steal', 'toy', 'collector', 'buzz', 'friend', 'set', 'rescue', 'mission', 'save', 'woody', 'museum', 'toy', 'property', 'roundup', 'gang', 'jessie', 'prospector', 'bullseye']",0,1,1,0,1,0,0,0,0,0,0,0,0,0,0,0,0,0,0,0,0,False,False,False,False,False,False,False,False,False,False,False,False,True,False,False,False,3,2,2,2,2
Boogie Nights,1997.0,155,7.9,"Back when sex was safe, pleasure was a business and business was booming, an idealistic porn producer aspires to elevate his craft to an art when he discovers a hot young talent.",85.0,239473,"26,400,640","['sex', 'safe', 'pleasure', 'business', 'business', 'boom', 'idealistic', 'porn', 'producer', 'aspire', 'elevate', 'craft', 'art', 'discover', 'hot', 'young', 'talent']",0,0,0,0,0,0,1,0,0,0,0,0,0,0,0,0,0,0,0,0,0,False,False,False,False,False,False,False,False,True,False,False,False,False,False,False,False,3,1,1,2,2
Mimi wo sumaseba,1995.0,111,7.9,"A love story between a girl who loves reading books, and a boy who has previously checked out all of the library books she chooses.",75.0,51943,15319107.2,"['love', 'story', 'girl', 'love', 'read', 'book', 'boy', 'previously', 'check', 'library', 'book', 'choose']",0,0,1,0,0,0,1,1,0,0,0,0,0,0,0,0,0,0,0,0,0,False,False,False,False,False,False,False,False,False,False,False,False,True,False,False,False,2,2,2,2,2
Once Were Warriors,1994.0,102,7.9,A family descended from Maori warriors is bedeviled by a violent father and the societal problems of being treated as outcasts.,77.0,31590,"2,201,126","['family', 'descend', 'maori', 'warrior', 'bedevil', 'violent', 'father', 'societal', 'problem', 'treat', 'outcast']",0,0,0,0,0,1,1,0,0,0,0,0,0,0,0,0,0,0,0,0,0,False,True,False,False,False,False,False,False,False,False,False,False,False,False,False,False,2,2,2,2,2
True Romance,1993.0,119,7.9,"In Detroit, a lonely pop culture geek marries a call girl, steals cocaine from her pimp, and tries to sell it in Hollywood. Meanwhile, the owners of the cocaine, the Mob, track them down in an attempt to reclaim it.",59.0,206918,"12,281,500","['detroit', 'lonely', 'pop', 'culture', 'geek', 'marry', 'girl', 'steal', 'cocaine', 'pimp', 'try', 'sell', 'hollywood', 'owner', 'cocaine', 'mob', 'track', 'attempt', 'reclaim']",0,0,0,0,0,1,1,0,0,0,0,0,0,0,0,1,0,0,0,0,0,False,False,False,False,False,False,False,False,True,False,False,False,False,False,False,False,1,2,1,1,2
Trois couleurs: Bleu,1993.0,94,7.9,A woman struggles to find a way to live her life after the death of her husband and child.,85.0,89836,"1,324,974","['woman', 'struggle', 'find', 'way', 'live', 'life', 'death', 'husband', 'child']",0,0,0,0,0,0,1,0,0,0,0,0,1,0,1,0,0,0,0,0,0,False,False,False,False,False,False,False,False,False,False,False,False,True,False,False,False,1,2,2,2,2
Jûbê ninpûchô,1993.0,94,7.9,A vagabond swordsman is aided by a beautiful ninja girl and a crafty spy in confronting a demonic clan of killers - with a ghost from his past as their leader - who are bent on overthrowing the Tokugawa Shogunate.,65.77675243356175,34529,13110046.5,"['vagabond', 'swordsman', 'aid', 'beautiful', 'ninja', 'girl', 'crafty', 'spy', 'confront', 'demonic', 'clan', 'killers', 'ghost', 'past', 'leader', 'bent', 'overthrow', 'tokugawa', 'shogunate']",1,1,1,0,0,0,0,0,0,0,0,0,0,0,0,0,0,0,0,0,0,False,True,False,False,False,False,False,False,False,False,False,False,False,False,False,False,1,2,2,2,2
Carlito's Way,1993.0,144,7.9,"A Puerto Rican former convict, just released from prison, pledges to stay away from drugs and violence despite the pressure around him and lead on to a better life outside of N.Y.C.",65.0,201000,"36,948,322","['puerto', 'rican', 'convict', 'release', 'prison', 'pledge', 'stay', 'away', 'drug', 'violence', 'despite', 'pressure', 'lead', 'well', 'life', 'outside']",0,0,0,0,0,1,1,0,0,0,0,0,0,0,0,0,0,0,1,0,0,False,True,False,False,False,False,False,False,False,False,False,False,False,False,False,False,3,3,1,2,2
Edward Scissorhands,1990.0,105,7.9,"An artificial man, who was incompletely constructed and has scissors for hands, leads a solitary life. Then one day, a suburban lady meets him and introduces him to her world.",74.0,447368,"56,362,352","['artificial', 'man', 'incompletely', 'construct', 'scissor', 'hand', 'lead', 'solitary', 'life', 'day', 'suburban', 'lady', 'meet', 'introduce', 'world']",0,0,0,0,0,0,1,0,1,0,0,0,0,0,0,1,0,0,0,0,0,False,False,False,False,False,False,False,False,False,False,False,False,True,False,False,False,1,1,2,2,2
My Left Foot: The Story of Christy Brown,1989.0,103,7.9,"Christy Brown, born with cerebral palsy, learns to paint and write with his only controllable limb - his left foot.",97.0,68076,"14,743,391","['christy', 'brown', 'bear', 'cerebral', 'palsy', 'learn', 'paint', 'write', 'controllable', 'limb', 'left', 'foot']",0,0,0,1,0,0,1,0,0,0,0,0,0,0,0,0,0,0,0,0,0,False,False,False,False,False,False,False,False,False,False,False,False,True,False,False,False,1,2,2,2,2
Crimes and Misdemeanors,1989.0,104,7.9,An ophthalmologist's mistress threatens to reveal their affair to his wife while a married documentary filmmaker is infatuated with another woman.,77.0,54670,"18,254,702","['ophthalmologist', 'mistress', 'threaten', 'reveal', 'affair', 'wife', 'married', 'documentary', 'filmmaker', 'infatuate', 'woman']",0,0,0,0,1,0,1,0,0,0,0,0,0,0,0,0,0,0,0,0,0,False,False,False,False,False,False,True,False,False,False,False,False,False,False,False,False,1,2,2,2,2
The Untouchables,1987.0,119,7.9,"During the era of Prohibition in the United States, Federal Agent Eliot Ness sets out to stop ruthless Chicago gangster Al Capone and, because of rampant corruption, assembles a small, hand-picked team to help him.",79.0,281842,"76,270,454","['era', 'prohibition', 'united', 'states', 'federal', 'agent', 'eliot', 'ness', 'set', 'stop', 'ruthless', 'chicago', 'gangster', 'al', 'capone', 'rampant', 'corruption', 'assemble', 'small', 'hand', 'pick', 'team', 'help']",0,0,0,0,0,1,1,0,0,0,0,0,0,0,0,0,0,0,1,0,0,False,True,False,False,False,False,False,False,False,False,False,False,False,False,False,False,3,2,3,2,2
Hannah and Her Sisters,1986.0,107,7.9,"Between two Thanksgivings two years apart, Hannah's husband falls in love with her sister Lee, while her hypochondriac ex-husband rekindles his relationship with her sister Holly.",90.0,67176,"40,084,041","['thanksgiving', 'year', 'apart', 'hannah', 'husband', 'fall', 'love', 'sister', 'lee', 'hypochondriac', 'ex', 'husband', 'rekindle', 'relationship', 'sister', 'holly']",0,0,0,0,1,0,1,0,0,0,0,0,0,0,0,0,0,0,0,0,0,False,False,False,False,False,False,True,False,False,False,False,False,False,False,False,False,1,1,2,2,2
Brazil,1985.0,132,7.9,A bureaucrat in a dystopic society becomes an enemy of the state as he pursues the woman of his dreams.,84.0,187567,"9,929,135","['bureaucrat', 'dystopic', 'society', 'enemy', 'state', 'pursue', 'woman', 'dream']",0,0,0,0,0,0,1,0,0,0,0,0,0,0,0,0,1,0,0,0,0,False,False,False,False,False,False,False,False,False,False,False,False,True,False,False,False,2,2,2,2,2
This Is Spinal Tap,1984.0,82,7.9,"Spinal Tap, one of England's loudest bands, is chronicled by film director Marty DiBergi on what proves to be a fateful tour.",92.0,128812,"188,751","['spinal', 'tap', 'england', 'loud', 'band', 'chronicle', 'film', 'director', 'marty', 'dibergi', 'prove', 'fateful', 'tour']",0,0,0,0,1,0,0,0,0,0,0,0,1,0,0,0,0,0,0,0,0,False,False,False,False,False,False,False,False,True,False,False,False,False,False,False,False,1,2,2,2,2
A Christmas Story,1983.0,93,7.9,"In the 1940s, a young boy named Ralphie attempts to convince his parents, his teacher and Santa that a Red Ryder BB gun really is the perfect Christmas gift.",77.0,132947,"20,605,209","['young', 'boy', 'name', 'ralphie', 'attempt', 'convince', 'parent', 'teacher', 'santa', 'red', 'ryder', 'bb', 'gun', 'perfect', 'christmas', 'gift']",0,0,0,0,1,0,0,1,0,0,0,0,0,0,0,0,0,0,0,0,0,False,False,False,False,False,False,False,False,False,False,False,False,True,False,False,False,2,2,2,2,2
The Blues Brothers,1980.0,133,7.9,"Jake Blues, just released from prison, puts together his old band to save the Catholic home where he and his brother Elwood were raised.",60.0,183182,"57,229,890","['jake', 'blues', 'release', 'prison', 'put', 'old', 'band', 'save', 'catholic', 'home', 'brother', 'elwood', 'raise']",1,1,0,0,1,0,0,0,0,0,0,0,0,0,0,0,0,0,0,0,0,False,False,False,False,False,False,False,False,False,False,False,False,True,False,False,False,2,2,1,2,2
Manhattan,1979.0,96,7.9,The life of a divorced television writer dating a teenage girl is further complicated when he falls in love with his best friend's mistress.,83.0,131436,"45,700,000","['life', 'divorced', 'television', 'writer', 'date', 'teenage', 'girl', 'complicate', 'fall', 'love', 'good', 'friend', 'mistress']",0,0,0,0,1,0,1,0,0,0,0,0,0,0,0,1,0,0,0,0,0,False,False,False,False,False,False,False,False,True,False,False,False,False,False,False,False,1,1,1,2,2
All That Jazz,1979.0,123,7.9,"Director/choreographer Bob Fosse tells his own life story as he details the sordid career of Joe Gideon, a womanizing, drug-using dancer.",72.0,28223,"37,823,676","['director', 'choreographer', 'bob', 'fosse', 'tell', 'life', 'story', 'detail', 'sordid', 'career', 'joe', 'gideon', 'womanizing', 'drug', 'dancer']",0,0,0,0,0,0,1,0,0,0,0,0,1,1,0,0,0,0,0,0,0,False,True,False,False,False,False,False,False,False,False,False,False,False,False,False,False,1,2,2,2,2
Dawn of the Dead,1978.0,127,7.9,"Following an ever-growing epidemic of zombies that have risen from the dead, two Philadelphia S.W.A.T. team members, a traffic reporter, and his television executive girlfriend seek refuge in a secluded shopping mall.",71.0,111512,"5,100,000","['follow', 'grow', 'epidemic', 'zombie', 'rise', 'dead', 'philadelphia', 'team', 'member', 'traffic', 'reporter', 'television', 'executive', 'girlfriend', 'seek', 'refuge', 'secluded', 'shopping', 'mall']",1,1,0,0,0,0,0,0,0,0,0,1,0,0,0,0,0,0,0,0,0,False,True,False,False,False,False,False,False,False,False,False,False,False,False,False,False,2,2,2,2,2
All the President's Men,1976.0,138,7.9,"""The Washington Post"" reporters Bob Woodward and Carl Bernstein uncover the details of the Watergate scandal that leads to President Richard Nixon's resignation.",84.0,103031,"70,600,000","['washington', 'post', 'reporter', 'bob', 'woodward', 'carl', 'bernstein', 'uncover', 'detail', 'watergate', 'scandal', 'lead', 'president', 'richard', 'nixon', 'resignation']",0,0,0,1,0,0,1,0,0,0,1,0,0,0,0,0,0,0,0,0,0,False,False,False,False,False,False,False,False,False,False,False,False,True,False,False,False,2,2,3,1,2
La montaña sagrada,1973.0,114,7.9,"In a corrupt, greed-fueled world, a powerful alchemist leads a messianic character and seven materialistic figures to the Holy Mountain, where they hope to achieve enlightenment.",76.0,37183,"61,001","['corrupt', 'greed', 'fuel', 'world', 'powerful', 'alchemist', 'lead', 'messianic', 'character', 'seven', 'materialistic', 'figure', 'holy', 'mountain', 'hope', 'achieve', 'enlightenment']",0,1,0,0,0,0,1,0,1,0,0,0,0,0,0,0,0,0,0,0,0,False,False,False,False,False,False,False,False,True,False,False,False,False,False,False,False,2,2,2,2,2
Amarcord,1973.0,123,7.9,A series of comedic and nostalgic vignettes set in a 1930s Italian coastal town.,89.36364608169468,39897,14782942.5,"['series', 'comedic', 'nostalgic', 'vignette', 'set', 'italian', 'coastal', 'town']",0,0,0,0,1,0,1,1,0,0,0,0,0,0,0,0,0,0,0,0,0,False,False,False,False,False,False,False,False,True,False,False,False,False,False,False,False,2,2,2,2,2
Le charme discret de la bourgeoisie,1972.0,102,7.9,"A surreal, virtually plotless series of dreams centered around six middle-class people and their consistently interrupted attempts to have a meal together.",93.0,38737,"198,809","['surreal', 'virtually', 'plotless', 'series', 'dream', 'center', 'middle', 'class', 'people', 'consistently', 'interrupt', 'attempt', 'meal']",0,0,0,0,1,0,0,0,0,0,0,0,0,0,0,0,0,0,0,0,0,False,False,False,False,False,True,False,False,False,False,False,False,False,False,False,False,1,2,2,2,2
"Aguirre, der Zorn Gottes",1972.0,95,7.9,"In the 16th century, the ruthless and insane Don Lope de Aguirre leads a Spanish expedition in search of El Dorado.",76.03145798455077,52397,13555712.7,"['century', 'ruthless', 'insane', 'don', 'lope', 'de', 'aguirre', 'lead', 'spanish', 'expedition', 'search', 'el', 'dorado']",1,1,0,1,0,0,0,0,0,0,0,0,0,0,0,0,0,0,0,0,0,False,False,False,False,False,False,False,False,True,False,False,False,False,False,False,False,2,2,2,2,2
Harold and Maude,1971.0,91,7.9,"Young, rich, and obsessed with death, Harold finds himself changed forever when he meets lively septuagenarian Maude at a funeral.",62.0,70826,19741287.2,"['young', 'rich', 'obsess', 'death', 'harold', 'find', 'change', 'forever', 'meet', 'lively', 'septuagenarian', 'maude', 'funeral']",0,0,0,0,1,0,1,0,0,0,0,0,0,0,0,1,0,0,0,0,0,False,False,False,False,False,True,False,False,False,False,False,False,False,False,False,False,2,2,2,2,2
Patton,1970.0,172,7.9,The World War II phase of the career of controversial American general George S. Patton.,91.0,93741,"61,700,000","['world', 'war', 'ii', 'phase', 'career', 'controversial', 'american', 'general', 'george', 'patton']",0,0,0,1,0,0,1,0,0,0,0,0,0,0,0,0,0,0,0,1,0,False,False,False,False,False,False,False,False,False,False,False,False,True,False,False,False,2,2,2,2,2
The Wild Bunch,1969.0,145,7.9,"An aging group of outlaws look for one last big score as the ""traditional"" American West is disappearing around them.",97.0,77401,"12,064,472","['age', 'group', 'outlaws', 'look', 'big', 'score', 'traditional', 'american', 'west', 'disappear']",1,1,0,0,0,0,0,0,0,0,0,0,0,0,0,0,0,0,0,0,1,False,True,False,False,False,False,False,False,False,False,False,False,False,False,False,False,2,3,1,2,2
Night of the Living Dead,1968.0,96,7.9,A ragtag group of Pennsylvanians barricade themselves in an old farmhouse to remain safe from a horde of flesh-eating ghouls that are ravaging the East Coast of the United States.,89.0,116557,"89,029","['ragtag', 'group', 'pennsylvanians', 'barricade', 'old', 'farmhouse', 'remain', 'safe', 'horde', 'flesh', 'eat', 'ghoul', 'ravage', 'east', 'coast', 'united', 'states']",0,0,0,0,0,0,0,0,0,0,0,1,0,0,0,0,0,0,1,0,0,False,True,False,False,False,False,False,False,False,False,False,False,False,False,False,False,2,2,2,2,2
The Lion in Winter,1968.0,134,7.9,"1183 A.D.: King Henry II's three sons all want to inherit the throne, but he won't commit to a choice. They and his wife variously plot to force him.",94.57943703107748,29003,"22,276,975","['king', 'henry', 'ii', 'son', 'want', 'inherit', 'throne', 'will', 'commit', 'choice', 'wife', 'variously', 'plot', 'force']",0,0,0,1,0,0,1,0,0,0,1,0,0,0,0,0,0,0,0,0,0,False,False,False,False,False,True,False,False,False,False,False,False,False,False,False,False,2,4,1,2,1
In the Heat of the Night,1967.0,110,7.9,A black police detective is asked to investigate a murder in a racially hostile southern town.,75.0,67804,"24,379,978","['black', 'police', 'detective', 'ask', 'investigate', 'murder', 'racially', 'hostile', 'southern', 'town']",0,0,0,0,0,1,1,0,0,0,0,0,0,0,1,0,0,0,0,0,0,False,False,False,False,False,False,False,False,False,False,False,False,True,False,False,False,1,2,2,2,2
Charade,1963.0,113,7.9,Romance and suspense ensue in Paris as a woman is pursued by several men who want a fortune her murdered husband had stolen. Whom can she trust?,83.0,68689,"13,474,588","['romance', 'suspense', 'ensue', 'paris', 'woman', 'pursue', 'man', 'want', 'fortune', 'murder', 'husband', 'steal', 'trust']",0,0,0,0,1,0,0,0,0,0,0,0,0,0,1,1,0,0,0,0,0,False,False,False,False,False,False,False,False,False,False,False,False,True,False,False,False,3,2,2,2,2
The Manchurian Candidate,1962.0,126,7.9,A former prisoner of war is brainwashed as an unwitting assassin for an international Communist conspiracy.,94.0,71122,11177510.6,"['prisoner', 'war', 'brainwash', 'unwitting', 'assassin', 'international', 'communist', 'conspiracy']",0,0,0,0,0,0,1,0,0,0,0,0,0,0,0,0,0,0,1,0,0,False,False,False,False,False,False,True,False,False,False,False,False,False,False,False,False,2,2,2,2,2
Spartacus,1960.0,197,7.9,The slave Spartacus leads a violent revolt against the decadent Roman Republic.,87.0,124339,"30,000,000","['slave', 'spartacus', 'lead', 'violent', 'revolt', 'decadent', 'roman', 'republic']",0,1,0,1,0,0,1,0,0,0,0,0,0,0,0,0,0,0,0,0,0,False,True,False,False,False,False,False,False,False,False,False,False,False,False,False,False,4,4,2,2,2
L'avventura,1960.0,144,7.9,"A woman disappears during a Mediterranean boating trip. During the search, her lover and her best friend become attracted to each other.",81.12961516825719,26542,13495067.1,"['woman', 'disappear', 'mediterranean', 'boat', 'trip', 'search', 'lover', 'good', 'friend', 'attract']",0,0,0,0,0,0,1,0,0,0,0,0,0,0,1,0,0,0,0,0,0,False,False,False,False,False,False,False,False,False,False,False,False,True,False,False,False,0,2,2,2,2
Hiroshima mon amour,1959.0,90,7.9,A French actress filming an anti-war film in Hiroshima has an affair with a married Japanese architect as they share their differing perspectives on war.,79.65778701682291,28421,"88,300","['french', 'actress', 'film', 'anti', 'war', 'film', 'hiroshima', 'affair', 'married', 'japanese', 'architect', 'share', 'differ', 'perspective', 'war']",0,0,0,0,0,0,1,0,0,0,0,0,0,0,0,1,0,0,0,0,0,False,False,False,False,False,False,False,False,False,False,False,False,True,False,False,False,2,2,2,2,2
The Ten Commandments,1956.0,220,7.9,"Moses, an Egyptian Prince, learns of his true heritage as a Hebrew and his divine mission as the deliverer of his people.",86.56352716846476,63560,"93,740,000","['moses', 'egyptian', 'prince', 'learn', 'true', 'heritage', 'hebrew', 'divine', 'mission', 'deliverer', 'people']",0,1,0,0,0,0,1,0,0,0,0,0,0,0,0,0,0,0,0,0,0,False,False,False,False,False,False,False,False,False,False,False,False,True,False,False,False,2,2,2,2,2
The Searchers,1956.0,119,7.9,An American Civil War veteran embarks on a journey to rescue his niece from the Comanches.,94.0,80316,10645144.1,"['american', 'civil', 'war', 'veteran', 'embark', 'journey', 'rescue', 'niece', 'comanche']",0,1,0,0,0,0,1,0,0,0,0,0,0,0,0,0,0,0,0,0,1,False,False,False,False,False,False,False,True,False,False,False,False,False,False,False,False,2,1,2,4,2
East of Eden,1955.0,118,7.9,"Two brothers struggle to maintain their strict, Bible-toting father's favor.",72.0,40313,12379792.1,"['brother', 'struggle', 'maintain', 'strict', 'bible', 'tote', 'father', 'favor']",0,0,0,0,0,0,1,0,0,0,0,0,0,0,0,0,0,0,0,0,0,False,False,False,False,False,False,False,False,False,False,False,False,True,False,False,False,2,1,2,2,2
High Noon,1952.0,85,7.9,"A town Marshal, despite the disagreements of his newlywed bride and the townspeople around him, must face a gang of deadly killers alone at high noon when the gang leader, an outlaw he sent up years ago, arrives on the noon train.",89.0,97222,"9,450,000","['town', 'marshal', 'despite', 'disagreement', 'newlywed', 'bride', 'townspeople', 'face', 'gang', 'deadly', 'killer', 'high', 'noon', 'gang', 'leader', 'outlaw', 'send', 'year', 'ago', 'arrive', 'noon', 'train']",0,0,0,0,0,0,1,0,0,0,0,0,0,0,0,0,0,0,1,0,1,False,False,False,False,False,True,False,False,False,False,False,False,False,False,False,False,0,2,4,2,2
Strangers on a Train,1951.0,101,7.9,A psychopath forces a tennis star to comply with his theory that two strangers can get away with murder.,88.0,123341,"7,630,000","['psychopath', 'force', 'tennis', 'star', 'comply', 'theory', 'stranger', 'away', 'murder']",0,0,0,0,0,1,0,0,0,1,0,0,0,0,0,0,0,0,1,0,0,False,True,False,False,False,False,False,False,False,False,False,False,False,False,False,False,3,2,2,2,2
Harvey,1950.0,104,7.9,"Due to his insistence that he has an invisible six foot-tall rabbit for a best friend, a whimsical middle-aged man is thought by his family to be insane - but he may be wiser than anyone knows.",86.27894688073573,52573,10654244.1,"['insistence', 'invisible', 'foot', 'tall', 'rabbit', 'good', 'friend', 'whimsical', 'middle', 'aged', 'man', 'think', 'family', 'insane', 'wise', 'know']",0,0,0,0,1,0,1,0,1,0,0,0,0,0,0,0,0,0,0,0,0,False,False,True,False,False,False,False,False,False,False,False,False,False,False,False,False,2,4,2,2,2
Miracle on 34th Street,1947.0,96,7.9,"When a nice old man who claims to be Santa Claus is institutionalized as insane, a young lawyer decides to defend him by arguing in court that he is the real thing.",88.0,41625,"2,650,000","['nice', 'old', 'man', 'claim', 'santa', 'claus', 'institutionalize', 'insane', 'young', 'lawyer', 'decide', 'defend', 'argue', 'court', 'real', 'thing']",0,0,0,0,1,0,1,1,0,0,0,0,0,0,0,0,0,0,0,0,0,False,False,False,False,False,False,False,False,False,False,False,False,True,False,False,False,2,2,1,2,2
Notorious,1946.0,102,7.9,A woman is asked to spy on a group of Nazi friends in South America. How far will she have to go to ingratiate herself with them?,100.0,92306,"10,464,000","['woman', 'ask', 'spy', 'group', 'nazi', 'friend', 'south', 'america', 'far', 'ingratiate']",0,0,0,0,0,0,1,0,0,1,0,0,0,0,0,1,0,0,0,0,0,False,False,False,False,False,False,False,False,False,False,False,False,True,False,False,False,3,2,4,2,2
The Big Sleep,1946.0,114,7.9,"Private detective Philip Marlowe is hired by a wealthy family. Before the complex case is over, he's seen murder, blackmail, and what might be love.",89.72272960326684,78796,"6,540,000","['private', 'detective', 'philip', 'marlowe', 'hire', 'wealthy', 'family', 'complex', 'case', 'see', 'murder', 'blackmail', 'love']",0,0,0,0,0,1,0,0,0,1,0,0,0,0,1,0,0,0,0,0,0,False,False,False,False,False,False,False,True,False,False,False,False,False,False,False,False,1,2,1,2,2
The Lost Weekend,1945.0,101,7.9,The desperate life of a chronic alcoholic is followed through a four-day drinking bout.,81.2129046778907,33549,"9,460,000","['desperate', 'life', 'chronic', 'alcoholic', 'follow', 'day', 'drinking', 'bout']",0,0,0,0,0,0,1,0,0,1,0,0,0,0,0,0,0,0,0,0,0,False,False,False,False,False,False,False,True,False,False,False,False,False,False,False,False,4,3,2,2,2
The Philadelphia Story,1940.0,112,7.9,"When a rich woman's ex-husband and a tabloid-type reporter turn up just before her planned remarriage, she begins to learn the truth about herself.",96.0,63550,10106785.3,"['rich', 'woman', 'ex', 'husband', 'tabloid', 'type', 'reporter', 'turn', 'plan', 'remarriage', 'begin', 'learn', 'truth']",0,0,0,0,1,0,0,0,0,0,0,0,0,0,0,1,0,0,0,0,0,False,False,False,False,False,False,False,False,False,False,False,False,True,False,False,False,1,2,1,2,2
His Girl Friday,1940.0,92,7.9,A newspaper editor uses every trick in the book to keep his ace reporter ex-wife from remarrying.,90.44926498580908,53667,"296,000","['newspaper', 'editor', 'use', 'trick', 'book', 'ace', 'reporter', 'ex', 'wife', 'remarry']",0,0,0,0,1,0,1,0,0,0,0,0,0,0,0,1,0,0,0,0,0,False,False,False,False,False,False,False,True,False,False,False,False,False,False,False,False,1,2,2,2,2
