Series_Title,Released_Year,Runtime,IMDB_Rating,Overview,Meta_score,No_of_Votes,Gross,overview_tokens,Genre_Action,Genre_Adventure,Genre_Animation,Genre_Biography,Genre_Comedy,Genre_Crime,Genre_Drama,Genre_Family,Genre_Fantasy,Genre_Film-Noir,Genre_History,Genre_Horror,Genre_Music,Genre_Musical,Genre_Mystery,Genre_Romance,Genre_Sci-Fi,Genre_Sport,Genre_Thriller,Genre_War,Genre_Western,Cert_16,Cert_A,Cert_Approved,Cert_G,Cert_GP,Cert_PG,Cert_PG-13,Cert_Passed,Cert_R,Cert_TV-14,Cert_TV-MA,Cert_TV-PG,Cert_U,Cert_U/A,Cert_UA,Cert_Unrated,Director_Group,Star1_Group,Star2_Group,Star3_Group,Star4_Group
Bride of Frankenstein,1935.0,75,7.8,"Mary Shelley reveals the main characters of her novel survived: Dr. Frankenstein, goaded by an even madder scientist, builds his monster a mate.",95.0,43542,"4,360,000","['mary', 'shelley', 'reveal', 'main', 'character', 'novel', 'survive', 'frankenstein', 'goad', 'madder', 'scientist', 'build', 'monster', 'mate']",0,0,0,0,0,0,1,0,0,0,0,1,0,0,0,0,1,0,0,0,0,False,False,False,False,False,False,False,False,False,False,False,False,True,False,False,False,0,1,1,1,1
Duck Soup,1933.0,69,7.8,Rufus T. Firefly is named president/dictator of bankrupt Freedonia and declares war on neighboring Sylvania over the love of wealthy Mrs. Teasdale.,93.0,55581,5872097.0,"['rufus', 'firefly', 'name', 'president', 'dictator', 'bankrupt', 'freedonia', 'declare', 'war', 'neighbor', 'sylvania', 'love', 'wealthy', 'teasdale']",0,0,0,0,1,0,0,0,0,0,0,0,0,1,0,0,0,0,0,1,0,False,False,False,False,False,False,False,False,False,False,False,False,True,False,False,False,1,1,1,2,1
Scarface: The Shame of the Nation,1932.0,93,7.8,"An ambitious and nearly insane violent gangster climbs the ladder of success in the mob, but his weaknesses prove to be his downfall.",87.0,25312,9543491.2,"['ambitious', 'nearly', 'insane', 'violent', 'gangster', 'climb', 'ladder', 'success', 'mob', 'weakness', 'prove', 'downfall']",1,0,0,0,0,1,1,0,0,0,0,0,0,0,0,0,0,0,0,0,0,False,False,False,False,False,True,False,False,False,False,False,False,False,False,False,False,1,1,1,1,1
Frankenstein,1931.0,70,7.8,Dr. Frankenstein dares to tamper with life and death by creating a human monster out of lifeless body parts.,91.0,65341,5981097.0,"['frankenstein', 'dare', 'tamper', 'life', 'death', 'create', 'human', 'monster', 'lifeless', 'body', 'part']",0,0,0,0,0,0,1,0,0,0,0,1,0,0,0,0,1,0,0,0,0,False,False,False,False,False,False,False,True,False,False,False,False,False,False,False,False,0,1,1,1,1
Roma,2018.0,135,7.7,A year in the life of a middle-class family's maid in Mexico City in the early 1970s.,96.0,140375,17561974.4,"['year', 'life', 'middle', 'class', 'family', 'maid', 'mexico', 'city', 'early']",0,0,0,0,0,0,1,0,0,0,0,0,0,0,0,0,0,0,0,0,0,False,False,False,False,False,False,False,False,True,False,False,False,False,False,False,False,0,0,0,0,0
God's Own Country,2017.0,104,7.7,"Spring. Yorkshire. Young farmer Johnny Saxby numbs his daily frustrations with binge drinking and casual sex, until the arrival of a Romanian migrant worker for lambing season ignites an intense relationship that sets Johnny on a new path.",85.0,25198,"335,609","['spring', 'yorkshire', 'young', 'farmer', 'johnny', 'saxby', 'numb', 'daily', 'frustration', 'binge', 'drinking', 'casual', 'sex', 'arrival', 'romanian', 'migrant', 'worker', 'lamb', 'season', 'ignite', 'intense', 'relationship', 'set', 'johnny', 'new', 'path']",0,0,0,0,0,0,1,0,0,0,0,0,0,0,0,1,0,0,0,0,0,False,False,False,False,False,False,False,False,False,False,False,False,True,False,False,False,0,0,0,0,0
Deadpool 2,2018.0,119,7.7,"Foul-mouthed mutant mercenary Wade Wilson (a.k.a. Deadpool), brings together a team of fellow mutant rogues to protect a young boy with supernatural abilities from the brutal, time-traveling cyborg Cable.",66.0,478586,"324,591,735","['foul', 'mouthed', 'mutant', 'mercenary', 'wade', 'wilson', 'deadpool', 'bring', 'team', 'fellow', 'mutant', 'rogue', 'protect', 'young', 'boy', 'supernatural', 'ability', 'brutal', 'time', 'travel', 'cyborg', 'cable']",1,1,0,0,1,0,0,0,0,0,0,0,0,0,0,0,0,0,0,0,0,False,False,False,False,False,False,False,False,True,False,False,False,False,False,False,False,0,1,0,0,0
Wind River,2017.0,107,7.7,A veteran hunter helps an FBI agent investigate the murder of a young woman on a Wyoming Native American reservation.,73.0,205444,"33,800,859","['veteran', 'hunter', 'help', 'fbi', 'agent', 'investigate', 'murder', 'young', 'woman', 'wyoming', 'native', 'american', 'reservation']",0,0,0,0,0,1,1,0,0,0,0,0,0,0,1,0,0,0,0,0,0,False,False,False,False,False,False,False,False,True,False,False,False,False,False,False,False,0,0,1,0,0
Get Out,2017.0,104,7.7,"A young African-American visits his white girlfriend's parents for the weekend, where his simmering uneasiness about their reception of him eventually reaches a boiling point.",85.0,492851,"176,040,665","['young', 'african', 'american', 'visit', 'white', 'girlfriend', 'parent', 'weekend', 'simmer', 'uneasiness', 'reception', 'eventually', 'reach', 'boiling', 'point']",0,0,0,0,0,0,0,0,0,0,0,1,0,0,1,0,0,0,1,0,0,False,False,False,False,False,False,False,False,True,False,False,False,False,False,False,False,0,0,0,0,0
Mission: Impossible - Fallout,2018.0,147,7.7,"Ethan Hunt and his IMF team, along with some familiar allies, race against time after a mission gone wrong.",86.0,291257,"220,159,104","['ethan', 'hunt', 'imf', 'team', 'familiar', 'ally', 'race', 'time', 'mission', 'go', 'wrong']",1,1,0,0,0,0,0,0,0,0,0,0,0,0,0,0,0,0,1,0,0,False,False,False,False,False,False,False,False,False,False,False,False,False,False,True,False,0,1,0,0,0
En man som heter Ove,2015.0,116,7.7,"Ove, an ill-tempered, isolated retiree who spends his days enforcing block association rules and visiting his wife's grave, has finally given up on life just as an unlikely friendship develops with his boisterous new neighbors.",70.0,47444,"3,358,518","['ove', 'ill', 'temper', 'isolate', 'retiree', 'spend', 'day', 'enforce', 'block', 'association', 'rule', 'visit', 'wife', 'grave', 'finally', 'give', 'life', 'unlikely', 'friendship', 'develop', 'boisterous', 'new', 'neighbor']",0,0,0,0,1,0,1,0,0,0,0,0,0,0,0,1,0,0,0,0,0,False,False,False,False,False,False,True,False,False,False,False,False,False,False,False,False,0,0,0,0,0
What We Do in the Shadows,2014.0,86,7.7,"Viago, Deacon and Vladislav are vampires who are finding that modern life has them struggling with the mundane - like paying rent, keeping up with the chore wheel, trying to get into nightclubs and overcoming flatmate conflicts.",76.0,157498,"3,333,000","['viago', 'deacon', 'vladislav', 'vampire', 'find', 'modern', 'life', 'struggle', 'mundane', 'like', 'pay', 'rent', 'keep', 'chore', 'wheel', 'try', 'nightclub', 'overcome', 'flatmate', 'conflict']",0,0,0,0,1,0,0,0,0,0,0,1,0,0,0,0,0,0,0,0,0,False,False,False,False,False,False,False,False,True,False,False,False,False,False,False,False,0,0,0,0,0
Omoide no Mânî,2014.0,103,7.7,"Due to 12 y.o. Anna's asthma, she's sent to stay with relatives of her guardian in the Japanese countryside. She likes to be alone, sketching. She befriends Marnie. Who is the mysterious, blonde Marnie.",72.0,32798,"765,127","['anna', 'asthma', 'send', 'stay', 'relative', 'guardian', 'japanese', 'countryside', 'like', 'sketch', 'befriend', 'marnie', 'mysterious', 'blonde', 'marnie']",0,0,1,0,0,0,1,1,0,0,0,0,0,0,0,0,0,0,0,0,0,False,False,False,False,False,False,False,False,False,False,False,False,True,False,False,False,0,0,0,0,0
The Theory of Everything,2014.0,123,7.7,A look at the relationship between the famous physicist Stephen Hawking and his wife.,72.0,404182,"35,893,537","['look', 'relationship', 'famous', 'physicist', 'stephen', 'hawking', 'wife']",0,0,0,1,0,0,1,0,0,0,0,0,0,0,0,1,0,0,0,0,0,False,False,False,False,False,False,False,False,False,False,False,False,True,False,False,False,0,1,0,0,0
Kingsman: The Secret Service,2014.0,129,7.7,"A spy organisation recruits a promising street kid into the agency's training program, while a global threat emerges from a twisted tech genius.",60.0,590440,"128,261,724","['spy', 'organisation', 'recruit', 'promising', 'street', 'kid', 'agency', 'training', 'program', 'global', 'threat', 'emerge', 'twisted', 'tech', 'genius']",1,1,0,0,1,0,0,0,0,0,0,0,0,0,0,0,0,0,0,0,0,False,True,False,False,False,False,False,False,False,False,False,False,False,False,False,False,0,1,0,2,4
The Fault in Our Stars,2014.0,126,7.7,Two teenage cancer patients begin a life-affirming journey to visit a reclusive author in Amsterdam.,69.0,344312,"124,872,350","['teenage', 'cancer', 'patient', 'begin', 'life', 'affirm', 'journey', 'visit', 'reclusive', 'author', 'amsterdam']",0,0,0,0,0,0,1,0,0,0,0,0,0,0,0,1,0,0,0,0,0,False,False,False,False,False,False,False,False,False,False,False,False,False,False,True,False,0,0,0,0,0
Me and Earl and the Dying Girl,2015.0,105,7.7,"High schooler Greg, who spends most of his time making parodies of classic movies with his co-worker Earl, finds his outlook forever altered after befriending a classmate who has just been diagnosed with cancer.",74.0,123210,"6,743,776","['high', 'schooler', 'greg', 'spend', 'time', 'make', 'parody', 'classic', 'movie', 'co', 'worker', 'earl', 'find', 'outlook', 'forever', 'alter', 'befriend', 'classmate', 'diagnose', 'cancer']",0,0,0,0,1,0,1,0,0,0,0,0,0,0,0,0,0,0,0,0,0,False,False,False,False,False,False,True,False,False,False,False,False,False,False,False,False,0,0,0,0,0
Birdman or (The Unexpected Virtue of Ignorance),2014.0,119,7.7,"A washed-up superhero actor attempts to revive his fading career by writing, directing, and starring in a Broadway production.",87.0,580291,"42,340,598","['wash', 'superhero', 'actor', 'attempt', 'revive', 'fade', 'career', 'writing', 'directing', 'star', 'broadway', 'production']",0,0,0,0,1,0,1,0,0,0,0,0,0,0,0,0,0,0,0,0,0,False,True,False,False,False,False,False,False,False,False,False,False,False,False,False,False,1,0,0,1,0
La vie d'Adèle,2013.0,180,7.7,"Adèle's life is changed when she meets Emma, a young woman with blue hair, who will allow her to discover desire and to assert herself as a woman and as an adult. In front of others, Adèle grows, seeks herself, loses herself, and ultimately finds herself through love and loss.",89.0,138741,"2,199,675","['adèle', 'life', 'change', 'meet', 'emma', 'young', 'woman', 'blue', 'hair', 'allow', 'discover', 'desire', 'assert', 'woman', 'adult', 'adèle', 'grow', 'seek', 'lose', 'ultimately', 'find', 'love', 'loss']",0,0,0,0,0,0,1,0,0,0,0,0,0,0,0,1,0,0,0,0,0,False,True,False,False,False,False,False,False,False,False,False,False,False,False,False,False,0,0,0,0,0
Kai po che!,2013.0,130,7.7,Three friends growing up in India at the turn of the millennium set out to open a training academy to produce the country's next cricket stars.,40.0,32628,"1,122,527","['friend', 'grow', 'india', 'turn', 'millennium', 'set', 'open', 'training', 'academy', 'produce', 'country', 'cricket', 'star']",0,0,0,0,0,0,1,0,0,0,0,0,0,0,0,0,0,1,0,0,0,False,False,False,False,False,False,False,False,False,False,False,False,True,False,False,False,0,0,0,0,0
The Broken Circle Breakdown,2012.0,111,7.7,"Elise and Didier fall in love at first sight, in spite of their differences. He talks, she listens. He's a romantic atheist, she's a religious realist. When their daughter becomes seriously ill, their love is put on trial.",70.0,39379,"175,058","['elise', 'didier', 'fall', 'love', 'sight', 'spite', 'difference', 'talk', 'listen', 'romantic', 'atheist', 'religious', 'realist', 'daughter', 'seriously', 'ill', 'love', 'trial']",0,0,0,0,0,0,1,0,0,0,0,0,1,0,0,1,0,0,0,0,0,False,False,False,False,False,False,False,False,False,False,False,False,True,False,False,False,0,0,0,0,0
Captain America: The Winter Soldier,2014.0,136,7.7,"As Steve Rogers struggles to embrace his role in the modern world, he teams up with a fellow Avenger and S.H.I.E.L.D agent, Black Widow, to battle a new threat from history: an assassin known as the Winter Soldier.",70.0,736182,"259,766,572","['steve', 'rogers', 'struggle', 'embrace', 'role', 'modern', 'world', 'team', 'fellow', 'avenger', 'agent', 'black', 'widow', 'battle', 'new', 'threat', 'history', 'assassin', 'know', 'winter', 'soldier']",1,1,0,0,0,0,0,0,0,0,0,0,0,0,0,0,1,0,0,0,0,False,False,False,False,False,False,False,False,False,False,False,False,False,False,True,False,3,3,1,2,1
Rockstar,2011.0,159,7.7,"Janardhan Jakhar chases his dreams of becoming a big Rock star, during which he falls in love with Heer.",77.61664875686809,39501,"985,912","['janardhan', 'jakhar', 'chase', 'dream', 'big', 'rock', 'star', 'fall', 'love', 'heer']",0,0,0,0,0,0,1,0,0,0,0,0,1,1,0,0,0,0,0,0,0,False,False,False,False,False,False,False,False,False,False,False,False,False,False,True,False,1,2,0,0,0
Nebraska,2013.0,115,7.7,"An aging, booze-addled father makes the trip from Montana to Nebraska with his estranged son in order to claim a million-dollar Mega Sweepstakes Marketing prize.",87.0,112298,"17,654,912","['age', 'booze', 'addle', 'father', 'make', 'trip', 'montana', 'nebraska', 'estranged', 'son', 'order', 'claim', 'million', 'dollar', 'mega', 'sweepstakes', 'marketing', 'prize']",0,1,0,0,1,0,1,0,0,0,0,0,0,0,0,0,0,0,0,0,0,False,False,False,False,False,False,False,False,False,False,False,False,False,False,True,False,0,0,0,0,0
Wreck-It Ralph,2012.0,101,7.7,"A video game villain wants to be a hero and sets out to fulfill his dream, but his quest brings havoc to the whole arcade where he lives.",72.0,380195,"189,422,889","['video', 'game', 'villain', 'want', 'hero', 'set', 'fulfill', 'dream', 'quest', 'bring', 'havoc', 'arcade', 'live']",0,1,1,0,1,0,0,0,0,0,0,0,0,0,0,0,0,0,0,0,0,False,False,False,False,False,False,False,False,False,False,False,False,True,False,False,False,0,0,0,0,0
Le Petit Prince,2015.0,108,7.7,"A little girl lives in a very grown-up world with her mother, who tries to prepare her for it. Her neighbor, the Aviator, introduces the girl to an extraordinary world where anything is possible, the world of the Little Prince.",70.0,56720,"1,339,152","['little', 'girl', 'live', 'grow', 'world', 'mother', 'try', 'prepare', 'neighbor', 'aviator', 'introduce', 'girl', 'extraordinary', 'world', 'possible', 'world', 'little', 'prince']",0,1,1,0,0,0,1,0,0,0,0,0,0,0,0,0,0,0,0,0,0,False,False,False,False,False,True,False,False,False,False,False,False,False,False,False,False,0,0,0,1,0
Detachment,2011.0,98,7.7,A substitute teacher who drifts from classroom to classroom finds a connection to the students and teachers during his latest assignment.,52.0,77071,"71,177","['substitute', 'teacher', 'drift', 'classroom', 'classroom', 'find', 'connection', 'student', 'teacher', 'late', 'assignment']",0,0,0,0,0,0,1,0,0,0,0,0,0,0,0,0,0,0,0,0,0,False,False,False,False,False,False,False,False,True,False,False,False,False,False,False,False,3,3,0,0,0
Midnight in Paris,2011.0,96,7.7,"While on a trip to Paris with his fiancée's family, a nostalgic screenwriter finds himself mysteriously going back to the 1920s every day at midnight.",81.0,388089,"56,816,662","['trip', 'paris', 'fiancée', 'family', 'nostalgic', 'screenwriter', 'find', 'mysteriously', 'go', 'day', 'midnight']",0,0,0,0,1,0,0,0,1,0,0,0,0,0,0,1,0,0,0,0,0,False,False,False,False,False,False,True,False,False,False,False,False,False,False,False,False,1,0,1,0,0
The Lego Movie,2014.0,100,7.7,"An ordinary LEGO construction worker, thought to be the prophesied as ""special"", is recruited to join a quest to stop an evil tyrant from gluing the LEGO universe into eternal stasis.",83.0,323982,"257,760,692","['ordinary', 'lego', 'construction', 'worker', 'think', 'prophesy', 'special', 'recruit', 'join', 'quest', 'stop', 'evil', 'tyrant', 'glue', 'lego', 'universe', 'eternal', 'stasis']",1,1,1,0,0,0,0,0,0,0,0,0,0,0,0,0,0,0,0,0,0,False,False,False,False,False,False,False,False,False,False,False,False,True,False,False,False,0,0,0,0,0
Gravity,2013.0,91,7.7,Two astronauts work together to survive after an accident leaves them stranded in space.,96.0,769145,"274,092,705","['astronaut', 'work', 'survive', 'accident', 'leave', 'strand', 'space']",0,0,0,0,0,0,1,0,0,0,0,0,0,0,0,0,1,0,1,0,0,False,False,False,False,False,False,False,False,False,False,False,False,False,False,True,False,0,0,0,1,0
Star Trek Into Darkness,2013.0,132,7.7,"After the crew of the Enterprise find an unstoppable force of terror from within their own organization, Captain Kirk leads a manhunt to a war-zone world to capture a one-man weapon of mass destruction.",72.0,463188,"228,778,661","['crew', 'enterprise', 'find', 'unstoppable', 'force', 'terror', 'organization', 'captain', 'kirk', 'lead', 'manhunt', 'war', 'zone', 'world', 'capture', 'man', 'weapon', 'mass', 'destruction']",1,1,0,0,0,0,0,0,0,0,0,0,0,0,0,0,1,0,0,0,0,False,False,False,False,False,False,False,False,False,False,False,False,False,False,True,False,1,0,1,0,0
Beasts of No Nation,2015.0,137,7.7,"A drama based on the experiences of Agu, a child soldier fighting in the civil war of an unnamed African country.",79.0,73964,"83,861","['drama', 'base', 'experience', 'agu', 'child', 'soldier', 'fight', 'civil', 'war', 'unnamed', 'african', 'country']",0,0,0,0,0,0,1,0,0,0,0,0,0,0,0,0,0,0,0,1,0,False,False,False,False,False,False,False,False,False,False,False,False,True,False,False,False,0,0,0,0,0
The Social Network,2010.0,120,7.7,"As Harvard student Mark Zuckerberg creates the social networking site that would become known as Facebook, he is sued by the twins who claimed he stole their idea, and by the co-founder who was later squeezed out of the business.",95.0,624982,"96,962,694","['harvard', 'student', 'mark', 'zuckerberg', 'create', 'social', 'networking', 'site', 'know', 'facebook', 'sue', 'twin', 'claim', 'steal', 'idea', 'co', 'founder', 'later', 'squeeze', 'business']",0,0,0,1,0,0,1,0,0,0,0,0,0,0,0,0,0,0,0,0,0,False,False,False,False,False,False,False,False,False,False,False,False,False,False,True,False,3,0,0,0,2
X: First Class,2011.0,131,7.7,"In the 1960s, superpowered humans Charles Xavier and Erik Lensherr work together to find others like them, but Erik's vengeful pursuit of an ambitious mutant who ruined his life causes a schism to divide them.",65.0,645512,"146,408,305","['superpowere', 'human', 'charles', 'xavier', 'erik', 'lensherr', 'work', 'find', 'like', 'erik', 'vengeful', 'pursuit', 'ambitious', 'mutant', 'ruin', 'life', 'cause', 'schism', 'divide']",1,1,0,0,0,0,0,0,0,0,0,0,0,0,0,0,1,0,0,0,0,False,False,False,False,False,False,False,False,False,False,False,False,False,False,True,False,0,0,0,0,0
The Hangover,2009.0,100,7.7,"Three buddies wake up from a bachelor party in Las Vegas, with no memory of the previous night and the bachelor missing. They make their way around the city in order to find their friend before his wedding.",73.0,717559,"277,322,503","['buddy', 'wake', 'bachelor', 'party', 'las', 'vegas', 'memory', 'previous', 'night', 'bachelor', 'miss', 'way', 'city', 'order', 'find', 'friend', 'wedding']",0,0,0,0,1,0,0,0,0,0,0,0,0,0,0,0,0,0,0,0,0,False,False,False,False,False,False,False,False,False,False,False,False,False,False,True,False,3,0,0,0,0
Skyfall,2012.0,143,7.7,"James Bond's loyalty to M is tested when her past comes back to haunt her. When MI6 comes under attack, 007 must track down and destroy the threat, no matter how personal the cost.",81.0,630614,"304,360,277","['james', 'bond', 'loyalty', 'm', 'test', 'past', 'come', 'haunt', 'come', 'attack', 'track', 'destroy', 'threat', 'matter', 'personal', 'cost']",1,1,0,0,0,0,0,0,0,0,0,0,0,0,0,0,0,0,1,0,0,False,False,False,False,False,False,False,False,False,False,False,False,False,False,True,False,2,1,0,0,0
Silver Linings Playbook,2012.0,122,7.7,"After a stint in a mental institution, former teacher Pat Solitano moves back in with his parents and tries to reconcile with his ex-wife. Things get more challenging when Pat meets Tiffany, a mysterious girl with problems of her own.",81.0,661871,"132,092,958","['stint', 'mental', 'institution', 'teacher', 'pat', 'solitano', 'move', 'parent', 'try', 'reconcile', 'ex', 'wife', 'thing', 'challenging', 'pat', 'meet', 'tiffany', 'mysterious', 'girl', 'problem']",0,0,0,0,1,0,1,0,0,0,0,0,0,0,0,1,0,0,0,0,0,False,True,False,False,False,False,False,False,False,False,False,False,False,False,False,False,0,0,0,2,0
Argo,2012.0,120,7.7,"Acting under the cover of a Hollywood producer scouting a location for a science fiction film, a CIA agent launches a dangerous operation to rescue six Americans in Tehran during the U.S. hostage crisis in Iran in 1979.",86.0,572581,"136,025,503","['act', 'cover', 'hollywood', 'producer', 'scout', 'location', 'science', 'fiction', 'film', 'cia', 'agent', 'launch', 'dangerous', 'operation', 'rescue', 'americans', 'tehran', 'hostage', 'crisis', 'iran']",0,0,0,1,0,0,1,0,0,0,0,0,0,0,0,0,0,0,1,0,0,False,True,False,False,False,False,False,False,False,False,False,False,False,False,False,False,0,2,0,2,0
(500) Days of Summer,2009.0,95,7.7,"An offbeat romantic comedy about a woman who doesn't believe true love exists, and the young man who falls for her.",76.0,472242,"32,391,374","['offbeat', 'romantic', 'comedy', 'woman', 'believe', 'true', 'love', 'exist', 'young', 'man', 'fall']",0,0,0,0,1,0,1,0,0,0,0,0,0,0,0,1,0,0,0,0,0,False,False,False,False,False,False,False,False,False,False,False,False,False,False,True,False,0,0,3,0,0
Harry Potter and the Deathly Hallows: Part 1,2010.0,146,7.7,"As Harry, Ron, and Hermione race against time and evil to destroy the Horcruxes, they uncover the existence of the three most powerful objects in the wizarding world: the Deathly Hallows.",65.0,479120,"295,983,305","['harry', 'ron', 'hermione', 'race', 'time', 'evil', 'destroy', 'horcruxes', 'uncover', 'existence', 'powerful', 'object', 'wizarde', 'world', 'deathly', 'hallows']",0,1,0,0,0,0,0,1,1,0,0,0,0,0,0,0,0,0,0,0,0,False,True,False,False,False,False,False,False,False,False,False,False,False,False,False,False,1,1,1,1,1
Gake no ue no Ponyo,2008.0,101,7.7,"A five-year-old boy develops a relationship with Ponyo, a young goldfish princess who longs to become a human after falling in love with him.",86.0,125317,"15,090,400","['year', 'old', 'boy', 'develop', 'relationship', 'ponyo', 'young', 'goldfish', 'princess', 'long', 'human', 'fall', 'love']",0,1,1,0,1,0,0,0,0,0,0,0,0,0,0,0,0,0,0,0,0,False,False,False,False,False,False,False,False,False,False,False,False,True,False,False,False,3,0,4,0,0
Frost/Nixon,2008.0,122,7.7,A dramatic retelling of the post-Watergate television interviews between British talk-show host David Frost and former president Richard Nixon.,80.0,103330,"18,593,156","['dramatic', 'retelling', 'post', 'watergate', 'television', 'interview', 'british', 'talk', 'host', 'david', 'frost', 'president', 'richard', 'nixon']",0,0,0,1,0,0,1,0,0,0,1,0,0,0,0,0,0,0,0,0,0,False,False,False,False,False,False,False,False,True,False,False,False,False,False,False,False,2,0,0,1,0
Papurika,2006.0,90,7.7,"When a machine that allows therapists to enter their patients' dreams is stolen, all Hell breaks loose. Only a young female therapist, Paprika, can stop it.",81.0,71379,"881,302","['machine', 'allow', 'therapist', 'enter', 'patient', 'dream', 'steal', 'hell', 'break', 'loose', 'young', 'female', 'therapist', 'paprika', 'stop']",0,0,1,0,0,0,1,0,1,0,0,0,0,0,0,0,0,0,0,0,0,False,False,False,False,False,False,False,False,False,False,False,False,True,False,False,False,1,0,1,0,0
Changeling,2008.0,141,7.7,Grief-stricken mother Christine Collins (Angelina Jolie) takes on the L.A.P.D. to her own detriment when it tries to pass off an obvious impostor as her missing child.,63.0,239203,"35,739,802","['grief', 'stricken', 'mother', 'christine', 'collins', 'angelina', 'jolie', 'take', 'detriment', 'try', 'pass', 'obvious', 'impostor', 'miss', 'child']",0,0,0,1,0,1,1,0,0,0,0,0,0,0,0,0,0,0,0,0,0,False,False,False,False,False,False,False,False,True,False,False,False,False,False,False,False,2,0,0,0,0
Flipped,2010.0,90,7.7,Two eighth-graders start to have feelings for each other despite being total opposites.,45.0,81446,"1,752,214","['eighth', 'grader', 'start', 'feeling', 'despite', 'total', 'opposite']",0,0,0,0,1,0,1,0,0,0,0,0,0,0,0,1,0,0,0,0,0,False,False,False,False,False,True,False,False,False,False,False,False,False,False,False,False,1,0,0,0,0
Toki o kakeru shôjo,2006.0,98,7.7,"A high-school girl named Makoto acquires the power to travel back in time, and decides to use it for her own personal benefits. Little does she know that she is affecting the lives of others just as much as she is her own.",72.93852079090166,60368,14154793.2,"['high', 'school', 'girl', 'name', 'makoto', 'acquire', 'power', 'travel', 'time', 'decide', 'use', 'personal', 'benefit', 'little', 'know', 'affect', 'life']",0,1,1,0,1,0,0,0,0,0,0,0,0,0,0,0,0,0,0,0,0,False,False,False,False,False,False,False,False,False,False,False,False,True,False,False,False,2,0,0,0,0
Death Note: Desu nôto,2006.0,126,7.7,"A battle between the world's two greatest minds begins when Light Yagami finds the Death Note, a notebook with the power to kill, and decides to rid the world of criminals.",79.92230742790832,28630,15588958.3,"['battle', 'world', 'great', 'mind', 'begin', 'light', 'yagami', 'find', 'death', 'note', 'notebook', 'power', 'kill', 'decide', 'rid', 'world', 'criminal']",0,0,0,0,0,1,1,0,1,0,0,0,0,0,0,0,0,0,0,0,0,False,True,False,False,False,False,False,False,False,False,False,False,False,False,False,False,0,0,0,0,0
This Is England,2006.0,101,7.7,"A young boy becomes friends with a gang of skinheads. Friends soon become like family, and relationships will be pushed to the very limit.",86.0,115576,"327,919","['young', 'boy', 'friend', 'gang', 'skinhead', 'friend', 'soon', 'like', 'family', 'relationship', 'push', 'limit']",0,0,0,0,0,1,1,0,0,0,0,0,0,0,0,0,0,0,0,0,0,False,True,False,False,False,False,False,False,False,False,False,False,False,False,False,False,0,0,0,0,0
